{"blocks": 11, "branch": "ar/calib2/delete50", "build_s": 305.8, "candidate": "delete50-load", "done_utc": "2026-10-02T22:36:07Z", "eval_id": "ar-20261002-cal2-delete50-load-r01", "eval_wall_s": 782.1, "failed_gate": null, "g0_s": 0.39, "g1_wait_s": 0.0, "load_burners": 10, "lock_wait_s": 183.7, "repeat": 1, "schema": "ar.calibration_ledger.v1", "stage_reached": "confirm", "started_utc": "2026-10-02T22:23:05Z", "test_compile_s": 23.7, "test_run_s": 64.9, "timed_held_s": 596.2, "verdict": "KEEP"}
{"blocks": 11, "branch": "ar/calib2/delete50", "build_s": 305.8, "candidate": "delete50-load", "done_utc": "2026-10-02T22:46:03Z", "eval_id": "ar-20261002-cal2-delete50-load-r02", "eval_wall_s": 595.9, "failed_gate": null, "g0_s": 0.36, "g1_wait_s": 0.0, "load_burners": 10, "lock_wait_s": 0.4, "repeat": 2, "schema": "ar.calibration_ledger.v1", "stage_reached": "confirm", "started_utc": "2026-10-02T22:36:07Z", "test_compile_s": 23.7, "test_run_s": 64.9, "timed_held_s": 593.5, "verdict": "KEEP"}
{"blocks": 11, "branch": "ar/calib2/delete50", "build_s": 305.8, "candidate": "delete50-load30", "done_utc": "2026-10-03T04:35:16Z", "eval_id": "ar-20261002-cal2-delete50-load30-r01", "eval_wall_s": 6310.4, "failed_gate": null, "g0_s": 0.32, "g1_wait_s": 0.0, "load_burners": 30, "lock_wait_s": 5558.4, "repeat": 1, "schema": "ar.calibration_ledger.v1", "stage_reached": "confirm", "started_utc": "2026-10-03T02:50:05Z", "test_compile_s": 23.7, "test_run_s": 64.9, "timed_held_s": 749.8, "verdict": "KEEP"}
{"blocks": 7, "branch": "ar/calib2/delete50", "build_s": 305.8, "candidate": "delete50-load30", "done_utc": "2026-10-03T05:51:37Z", "eval_id": "ar-20261002-cal2-delete50-load30-r02", "eval_wall_s": 4581.3, "failed_gate": null, "g0_s": 0.38, "g1_wait_s": 0.0, "load_burners": 30, "lock_wait_s": 4081.3, "repeat": 2, "schema": "ar.calibration_ledger.v1", "stage_reached": "confirm", "started_utc": "2026-10-03T04:35:16Z", "test_compile_s": 23.7, "test_run_s": 64.9, "timed_held_s": 498.1, "verdict": "INFRA"}
{"blocks": 11, "branch": "ar/calib2/delete50", "build_s": 305.8, "candidate": "delete50-load30c", "done_utc": "2026-10-03T06:42:36Z", "eval_id": "ar-20261002-cal2-delete50-load30c-r01", "eval_wall_s": 688.3, "failed_gate": null, "g0_s": 0.2, "g1_wait_s": 0.0, "load_burners": 30, "lock_wait_s": 0.1, "repeat": 1, "schema": "ar.calibration_ledger.v1", "stage_reached": "confirm", "started_utc": "2026-10-03T06:31:08Z", "test_compile_s": 23.7, "test_run_s": 64.9, "timed_held_s": 686.3, "verdict": "KEEP"}
{"blocks": 11, "branch": "ar/calib2/delete50", "build_s": 305.8, "candidate": "delete50-load30c", "done_utc": "2026-10-03T06:54:58Z", "eval_id": "ar-20261002-cal2-delete50-load30c-r02", "eval_wall_s": 741.6, "failed_gate": null, "g0_s": 0.27, "g1_wait_s": 0.0, "load_burners": 30, "lock_wait_s": 53.8, "repeat": 2, "schema": "ar.calibration_ledger.v1", "stage_reached": "confirm", "started_utc": "2026-10-03T06:42:36Z", "test_compile_s": 23.7, "test_run_s": 64.9, "timed_held_s": 686.0, "verdict": "KEEP"}
{"blocks": 11, "branch": "ar/calib2/delete50", "build_s": 305.8, "candidate": "delete50", "done_utc": "2026-10-02T20:05:25Z", "eval_id": "ar-20261002-cal2-delete50-r01", "eval_wall_s": 6811.1, "failed_gate": null, "g0_s": 0.47, "g1_wait_s": 0.0, "load_burners": 0, "lock_wait_s": 6178.6, "repeat": 1, "schema": "ar.calibration_ledger.v1", "stage_reached": "confirm", "started_utc": "2026-10-02T18:11:54Z", "test_compile_s": 23.7, "test_run_s": 64.9, "timed_held_s": 629.4, "verdict": "KEEP"}
{"blocks": 11, "branch": "ar/calib2/delete50", "build_s": 305.8, "candidate": "delete50", "done_utc": "2026-10-02T20:43:50Z", "eval_id": "ar-20261002-cal2-delete50-r02", "eval_wall_s": 2304.8, "failed_gate": null, "g0_s": 0.39, "g1_wait_s": 0.0, "load_burners": 0, "lock_wait_s": 1697.5, "repeat": 2, "schema": "ar.calibration_ledger.v1", "stage_reached": "confirm", "started_utc": "2026-10-02T20:05:25Z", "test_compile_s": 23.7, "test_run_s": 64.9, "timed_held_s": 604.9, "verdict": "KEEP"}
{"blocks": 11, "branch": "ar/calib2/delete50", "build_s": 305.8, "candidate": "delete50", "done_utc": "2026-10-02T20:53:55Z", "eval_id": "ar-20261002-cal2-delete50-r03", "eval_wall_s": 605.4, "failed_gate": null, "g0_s": 0.34, "g1_wait_s": 0.0, "load_burners": 0, "lock_wait_s": 14.3, "repeat": 3, "schema": "ar.calibration_ledger.v1", "stage_reached": "confirm", "started_utc": "2026-10-02T20:43:50Z", "test_compile_s": 23.7, "test_run_s": 64.9, "timed_held_s": 588.9, "verdict": "KEEP"}
{"blocks": 11, "branch": "ar/calib2/delete50", "build_s": 305.8, "candidate": "delete50", "done_utc": "2026-10-02T21:04:28Z", "eval_id": "ar-20261002-cal2-delete50-r04", "eval_wall_s": 632.8, "failed_gate": null, "g0_s": 0.36, "g1_wait_s": 0.0, "load_burners": 0, "lock_wait_s": 41.6, "repeat": 4, "schema": "ar.calibration_ledger.v1", "stage_reached": "confirm", "started_utc": "2026-10-02T20:53:55Z", "test_compile_s": 23.7, "test_run_s": 64.9, "timed_held_s": 588.9, "verdict": "KEEP"}
{"blocks": 11, "branch": "ar/calib2/delete50", "build_s": 305.8, "candidate": "delete50", "done_utc": "2026-10-02T21:14:18Z", "eval_id": "ar-20261002-cal2-delete50-r05", "eval_wall_s": 590.1, "failed_gate": null, "g0_s": 0.34, "g1_wait_s": 0.0, "load_burners": 0, "lock_wait_s": 0.3, "repeat": 5, "schema": "ar.calibration_ledger.v1", "stage_reached": "confirm", "started_utc": "2026-10-02T21:04:28Z", "test_compile_s": 23.7, "test_run_s": 64.9, "timed_held_s": 587.7, "verdict": "KEEP"}
{"blocks": 11, "branch": "ar/calib2/delete50", "build_s": 305.8, "candidate": "delete50", "done_utc": "2026-10-02T21:24:27Z", "eval_id": "ar-20261002-cal2-delete50-r06", "eval_wall_s": 608.4, "failed_gate": null, "g0_s": 0.27, "g1_wait_s": 0.0, "load_burners": 0, "lock_wait_s": 18.6, "repeat": 6, "schema": "ar.calibration_ledger.v1", "stage_reached": "confirm", "started_utc": "2026-10-02T21:14:18Z", "test_compile_s": 23.7, "test_run_s": 64.9, "timed_held_s": 587.8, "verdict": "KEEP"}
{"blocks": 11, "branch": "ar/calib2/delete50", "build_s": 305.8, "candidate": "delete50", "done_utc": "2026-10-02T21:34:17Z", "eval_id": "ar-20261002-cal2-delete50-r07", "eval_wall_s": 589.9, "failed_gate": null, "g0_s": 0.26, "g1_wait_s": 0.0, "load_burners": 0, "lock_wait_s": 0.3, "repeat": 7, "schema": "ar.calibration_ledger.v1", "stage_reached": "confirm", "started_utc": "2026-10-02T21:24:27Z", "test_compile_s": 23.7, "test_run_s": 64.9, "timed_held_s": 587.6, "verdict": "KEEP"}
{"blocks": 11, "branch": "ar/calib2/delete50", "build_s": 305.8, "candidate": "delete50", "done_utc": "2026-10-02T21:44:09Z", "eval_id": "ar-20261002-cal2-delete50-r08", "eval_wall_s": 592.1, "failed_gate": null, "g0_s": 0.36, "g1_wait_s": 0.0, "load_burners": 0, "lock_wait_s": 0.3, "repeat": 8, "schema": "ar.calibration_ledger.v1", "stage_reached": "confirm", "started_utc": "2026-10-02T21:34:17Z", "test_compile_s": 23.7, "test_run_s": 64.9, "timed_held_s": 589.7, "verdict": "KEEP"}
{"blocks": 11, "branch": "ar/calib2/delete50", "build_s": 305.8, "candidate": "delete50", "done_utc": "2026-10-02T21:54:00Z", "eval_id": "ar-20261002-cal2-delete50-r09", "eval_wall_s": 591.6, "failed_gate": null, "g0_s": 0.2, "g1_wait_s": 0.0, "load_burners": 0, "lock_wait_s": 0.2, "repeat": 9, "schema": "ar.calibration_ledger.v1", "stage_reached": "confirm", "started_utc": "2026-10-02T21:44:09Z", "test_compile_s": 23.7, "test_run_s": 64.9, "timed_held_s": 589.4, "verdict": "KEEP"}
{"blocks": 11, "branch": "ar/calib2/delete50", "build_s": 305.8, "candidate": "delete50", "done_utc": "2026-10-02T22:03:55Z", "eval_id": "ar-20261002-cal2-delete50-r10", "eval_wall_s": 595.1, "failed_gate": null, "g0_s": 0.23, "g1_wait_s": 0.0, "load_burners": 0, "lock_wait_s": 0.2, "repeat": 10, "schema": "ar.calibration_ledger.v1", "stage_reached": "confirm", "started_utc": "2026-10-02T21:54:00Z", "test_compile_s": 23.7, "test_run_s": 64.9, "timed_held_s": 592.6, "verdict": "KEEP"}
{"blocks": 0, "branch": "ar/calib2/g0-frozen-item", "build_s": 0.0, "candidate": "g0-frozen-item", "done_utc": "2026-10-02T22:07:07Z", "eval_id": "ar-20261002-cal2-g0-frozen-item-r01", "eval_wall_s": 0.4, "failed_gate": "G0", "g0_s": 0.39, "g1_wait_s": 0.0, "load_burners": 0, "lock_wait_s": 0, "repeat": 1, "schema": "ar.calibration_ledger.v1", "stage_reached": "g0", "started_utc": "2026-10-02T22:07:07Z", "test_compile_s": 0.0, "test_run_s": 0.0, "timed_held_s": 0, "verdict": "REJECT"}
{"blocks": 0, "branch": "ar/calib2/g0-scanner", "build_s": 0.0, "candidate": "g0-scanner", "done_utc": "2026-10-02T22:07:08Z", "eval_id": "ar-20261002-cal2-g0-scanner-r01", "eval_wall_s": 0.3, "failed_gate": "G0", "g0_s": 0.33, "g1_wait_s": 0.0, "load_burners": 0, "lock_wait_s": 0, "repeat": 1, "schema": "ar.calibration_ledger.v1", "stage_reached": "g0", "started_utc": "2026-10-02T22:07:08Z", "test_compile_s": 0.0, "test_run_s": 0.0, "timed_held_s": 0, "verdict": "REJECT"}
{"blocks": 0, "branch": "ar/calib2/g0-test-item", "build_s": 0.0, "candidate": "g0-test-item", "done_utc": "2026-10-02T22:07:08Z", "eval_id": "ar-20261002-cal2-g0-test-item-r01", "eval_wall_s": 0.3, "failed_gate": "G0", "g0_s": 0.29, "g1_wait_s": 0.0, "load_burners": 0, "lock_wait_s": 0, "repeat": 1, "schema": "ar.calibration_ledger.v1", "stage_reached": "g0", "started_utc": "2026-10-02T22:07:07Z", "test_compile_s": 0.0, "test_run_s": 0.0, "timed_held_s": 0, "verdict": "REJECT"}
{"blocks": 0, "branch": "ar/calib2/g0-trace-line", "build_s": 0.0, "candidate": "g0-trace-line", "done_utc": "2026-10-02T22:07:08Z", "eval_id": "ar-20261002-cal2-g0-trace-line-r01", "eval_wall_s": 0.3, "failed_gate": "G0", "g0_s": 0.32, "g1_wait_s": 0.0, "load_burners": 0, "lock_wait_s": 0, "repeat": 1, "schema": "ar.calibration_ledger.v1", "stage_reached": "g0", "started_utc": "2026-10-02T22:07:08Z", "test_compile_s": 0.0, "test_run_s": 0.0, "timed_held_s": 0, "verdict": "REJECT"}
{"blocks": 1, "branch": "ar/calib2/new-socket", "build_s": 97.8, "candidate": "new-socket", "done_utc": "2026-10-02T22:23:05Z", "eval_id": "ar-20261002-cal2-new-socket-r01", "eval_wall_s": 135.4, "failed_gate": "G2", "g0_s": 0.52, "g1_wait_s": 0.0, "load_burners": 0, "lock_wait_s": 78.7, "repeat": 1, "schema": "ar.calibration_ledger.v1", "stage_reached": "screen", "started_utc": "2026-10-02T22:20:50Z", "test_compile_s": 16.7, "test_run_s": 63.5, "timed_held_s": 55.2, "verdict": "REJECT"}
{"blocks": 1, "branch": "ar/calib2/noop01", "build_s": 99.4, "candidate": "noop01", "done_utc": "2026-10-02T22:08:09Z", "eval_id": "ar-20261002-cal2-noop01-r01", "eval_wall_s": 61.0, "failed_gate": null, "g0_s": 0.42, "g1_wait_s": 0.0, "load_burners": 0, "lock_wait_s": 0.1, "repeat": 1, "schema": "ar.calibration_ledger.v1", "stage_reached": "screen", "started_utc": "2026-10-02T22:07:08Z", "test_compile_s": 478.9, "test_run_s": 79.7, "timed_held_s": 58.9, "verdict": "REVERT"}
{"blocks": 1, "branch": "ar/calib2/noop02", "build_s": 228.5, "candidate": "noop02", "done_utc": "2026-10-02T22:09:08Z", "eval_id": "ar-20261002-cal2-noop02-r01", "eval_wall_s": 58.5, "failed_gate": null, "g0_s": 0.46, "g1_wait_s": 0.0, "load_burners": 0, "lock_wait_s": 0.1, "repeat": 1, "schema": "ar.calibration_ledger.v1", "stage_reached": "screen", "started_utc": "2026-10-02T22:08:09Z", "test_compile_s": 21.9, "test_run_s": 68.3, "timed_held_s": 56.8, "verdict": "REVERT"}
{"blocks": 1, "branch": "ar/calib2/noop03", "build_s": 115.3, "candidate": "noop03", "done_utc": "2026-10-02T22:10:05Z", "eval_id": "ar-20261002-cal2-noop03-r01", "eval_wall_s": 57.1, "failed_gate": null, "g0_s": 0.37, "g1_wait_s": 0.0, "load_burners": 0, "lock_wait_s": 0.1, "repeat": 1, "schema": "ar.calibration_ledger.v1", "stage_reached": "screen", "started_utc": "2026-10-02T22:09:08Z", "test_compile_s": 324.9, "test_run_s": 70.1, "timed_held_s": 55.6, "verdict": "REVERT"}
{"blocks": 1, "branch": "ar/calib2/noop04", "build_s": 124.3, "candidate": "noop04", "done_utc": "2026-10-02T22:11:19Z", "eval_id": "ar-20261002-cal2-noop04-r01", "eval_wall_s": 74.5, "failed_gate": null, "g0_s": 0.41, "g1_wait_s": 0.0, "load_burners": 0, "lock_wait_s": 16.0, "repeat": 1, "schema": "ar.calibration_ledger.v1", "stage_reached": "screen", "started_utc": "2026-10-02T22:10:05Z", "test_compile_s": 24.0, "test_run_s": 68.2, "timed_held_s": 56.7, "verdict": "REVERT"}
{"blocks": 0, "branch": "ar/calib2/noop05", "build_s": 490.4, "candidate": "noop05", "done_utc": "2026-10-02T22:11:20Z", "eval_id": "ar-20261002-cal2-noop05-r01", "eval_wall_s": 0.7, "failed_gate": "G1", "g0_s": 0.65, "g1_wait_s": 0.0, "load_burners": 0, "lock_wait_s": 0, "repeat": 1, "schema": "ar.calibration_ledger.v1", "stage_reached": "g1", "started_utc": "2026-10-02T22:11:20Z", "test_compile_s": 33.5, "test_run_s": 102.5, "timed_held_s": 0, "verdict": "REJECT"}
{"blocks": 1, "branch": "ar/calib2/noop06", "build_s": 166.3, "candidate": "noop06", "done_utc": "2026-10-02T22:12:28Z", "eval_id": "ar-20261002-cal2-noop06-r01", "eval_wall_s": 67.7, "failed_gate": null, "g0_s": 0.47, "g1_wait_s": 0.0, "load_burners": 0, "lock_wait_s": 8.3, "repeat": 1, "schema": "ar.calibration_ledger.v1", "stage_reached": "screen", "started_utc": "2026-10-02T22:11:20Z", "test_compile_s": 231.9, "test_run_s": 73.0, "timed_held_s": 57.6, "verdict": "REVERT"}
{"blocks": 1, "branch": "ar/calib2/noop07", "build_s": 159.9, "candidate": "noop07", "done_utc": "2026-10-02T22:13:23Z", "eval_id": "ar-20261002-cal2-noop07-r01", "eval_wall_s": 55.2, "failed_gate": null, "g0_s": 0.29, "g1_wait_s": 0.0, "load_burners": 0, "lock_wait_s": 0.0, "repeat": 1, "schema": "ar.calibration_ledger.v1", "stage_reached": "screen", "started_utc": "2026-10-02T22:12:28Z", "test_compile_s": 14.4, "test_run_s": 64.9, "timed_held_s": 54.0, "verdict": "REVERT"}
{"blocks": 1, "branch": "ar/calib2/noop08", "build_s": 92.6, "candidate": "noop08", "done_utc": "2026-10-02T22:15:34Z", "eval_id": "ar-20261002-cal2-noop08-r01", "eval_wall_s": 131.2, "failed_gate": null, "g0_s": 0.18, "g1_wait_s": 0.0, "load_burners": 0, "lock_wait_s": 73.5, "repeat": 1, "schema": "ar.calibration_ledger.v1", "stage_reached": "screen", "started_utc": "2026-10-02T22:13:23Z", "test_compile_s": 12.3, "test_run_s": 65.7, "timed_held_s": 56.5, "verdict": "REVERT"}
{"blocks": 1, "branch": "ar/calib2/noop09", "build_s": 95.9, "candidate": "noop09", "done_utc": "2026-10-02T22:16:50Z", "eval_id": "ar-20261002-cal2-noop09-r01", "eval_wall_s": 75.9, "failed_gate": null, "g0_s": 0.5, "g1_wait_s": 0.0, "load_burners": 0, "lock_wait_s": 18.3, "repeat": 1, "schema": "ar.calibration_ledger.v1", "stage_reached": "screen", "started_utc": "2026-10-02T22:15:34Z", "test_compile_s": 12.1, "test_run_s": 66.4, "timed_held_s": 55.6, "verdict": "REVERT"}
{"blocks": 1, "branch": "ar/calib2/noop10", "build_s": 539.1, "candidate": "noop10", "done_utc": "2026-10-02T22:20:50Z", "eval_id": "ar-20261002-cal2-noop10-r01", "eval_wall_s": 239.7, "failed_gate": null, "g0_s": 0.39, "g1_wait_s": 0.0, "load_burners": 0, "lock_wait_s": 185.5, "repeat": 1, "schema": "ar.calibration_ledger.v1", "stage_reached": "screen", "started_utc": "2026-10-02T22:16:50Z", "test_compile_s": 12.9, "test_run_s": 65.0, "timed_held_s": 52.7, "verdict": "REVERT"}
{"blocks": 0, "branch": "ar/calib2/sleep20", "build_s": 527.5, "candidate": "sleep20", "done_utc": "2026-10-02T17:49:11Z", "eval_id": "ar-20261002-cal2-sleep20-r01", "eval_wall_s": 761.4, "failed_gate": "G1", "g0_s": 1.1, "g1_wait_s": 760.2, "load_burners": 0, "lock_wait_s": 0, "repeat": 1, "schema": "ar.calibration_ledger.v1", "stage_reached": "g1", "started_utc": "2026-10-02T17:36:29Z", "test_compile_s": 149.2, "test_run_s": 78.4, "timed_held_s": 0, "verdict": "REJECT"}
{"blocks": 1, "branch": "ar/calib2/sleep50", "build_s": 294.6, "candidate": "sleep50", "done_utc": "2026-10-02T18:11:54Z", "eval_id": "ar-20261002-cal2-sleep50-r01", "eval_wall_s": 1363.6, "failed_gate": null, "g0_s": 0.63, "g1_wait_s": 740.1, "load_burners": 0, "lock_wait_s": 566.6, "repeat": 1, "schema": "ar.calibration_ledger.v1", "stage_reached": "screen", "started_utc": "2026-10-02T17:49:11Z", "test_compile_s": 345.1, "test_run_s": 95.3, "timed_held_s": 55.2, "verdict": "REVERT"}
{"blocks": 1, "branch": "ar/calib2/success-early", "build_s": 98.4, "candidate": "success-early", "done_utc": "2026-10-02T22:07:07Z", "eval_id": "ar-20261002-cal2-success-early-r01", "eval_wall_s": 191.5, "failed_gate": "G2", "g0_s": 0.81, "g1_wait_s": 0.0, "load_burners": 0, "lock_wait_s": 0.0, "repeat": 1, "schema": "ar.calibration_ledger.v1", "stage_reached": "screen", "started_utc": "2026-10-02T22:03:55Z", "test_compile_s": 66.3, "test_run_s": 67.7, "timed_held_s": 189.4, "verdict": "REJECT"}
